{
  "name": "intellij",
  "version": "0.1.0",
  "description": "Register IntelliJ IDEA's MCP server for individual Codex projects.",
  "keywords": [
    "intellij",
    "jetbrains",
    "mcp"
  ],
  "skills": "./skills",
  "interface": {
    "displayName": "IntelliJ",
    "shortDescription": "Set up IntelliJ MCP for the current Codex project."
  }
}
